"","eucalypts","bark"
"158","Eucalyptus diptera","smooth throughout, with oily sheen, greenish grey to bronze, coppery or brown."
"159","Eucalyptus discreta","smooth throughout, creamy brown and pale grey, sometimes with persistent coarse ribbons of greyish rough bark for up to 1 m of stems."
"160","Eucalyptus distuberosa","wholly smooth, light grey to grey andbrown over orange to yellow, creamy whiteor light tan; shedding in long ribbons conspicuously hangingfrom branches to ground level in springtime."
"161","Eucalyptus diversifolia","rough on lower trunk of shrubs, in mallees extending to ca 4 cm diameter branches, fibrous, greyish brown. "
"162","Eucalyptus dives","rough to the large branches, finely fibrous (peppermint-type), grey to grey-brown; smooth bark grey."
"163","Eucalyptus dolichocera","rough for 2-3 m over the lower trunk, fibrous, flaky; smooth bark grey to white over orange-cream."
"164","Eucalyptus dolichorhyncha","smooth throughout, pale grey over pale orange to pale brown, shedding in broad ribbons."
"165","Eucalyptus dolorosa","rough, thin and flaky to hard and furrowed, grey to yellowish brown, for ca 0.5 m of trunk, smooth above, pale grey-brown. "
"166","Eucalyptus doratoxylon","smooth throughout, powdery white over reddish or greenish brown, rarely with a short stocking of flaky rough grey-black bark. "
"167","Eucalyptus dorrienii","smooth throughout, silvery grey and green-grey over pale brown-orange. "
"168","Eucalyptus dorrigoensis","smooth throughout or with some grey to grey-brown slabs of rough bark persisting on base of trunk; smooth bark sometimes slightly powdery, white, cream, pink or grey, often with ribbons of decorticated bark in the upper branches."
"169","Eucalyptus drummondii","smooth throughout, often powdery, whitish to grey and red-brown mottled. "
"170","Eucalyptus dumosa","usually rough on lower part of stems, grey or grey-brown, flaky or box-type; smooth bark white, yellow, grey, brown or pink-grey, shedding in ribbons from the upper stems and branches, rarely powdery. "
"171","Eucalyptus dundasii","rough, tightly held, blackish, scaly or tessellated for 2-3 m or more of trunk, then smooth blackish grey-green over coppery."
"172","Eucalyptus dunnii","rough for up to 4 m then smooth; rough bark loose basal slabs or corky, grey or brown; smooth bark usually white to cream, with patches of yellow, grey or green, long ribbons often hanging from crown."
"173","Eucalyptus dwyeri","smooth throughout, rarely with a few loose basal slabs of rough bark; smooth bark white or cream with grey, orange or brown patches, sometimes powdery."
"174","Eucalyptus ebbanoensis","usually smooth, grey to creamy-brown, sometimes grey over salmon-pink, larger individuals with a short stocking of light grey to brown flaky rough bark. "
"175","Eucalyptus ecostata","smooth throughout, silvery grey and cream-grey over pale brown-orange. "
"176","Eucalyptus educta","minnirichi throughout, reddish brown. "
"177","Eucalyptus elaeophloia","smooth throughout or with some persistent rough bark at the base of stems; smooth bark green to grey-green with coppery or brown patches."
"178","Eucalyptus elliptica","smooth, usually powdery, white with yellow, orange or grey patches, horizontal black scars sometimes present on trunk."
"179","Eucalyptus erectifolia","smooth grey-brown."
"180","Eucalyptus eremicola","usually rough on the lower half of the stems, fibrous on larger stems, flaky to ribbony and loosely held on smaller stems, grey; smooth bark grey to brown over white."
"181","Eucalyptus erosa","rough to small branches, stringy, grey or grey-brown."
"182","Eucalyptus erythrandra","usually entirely smooth, fawn to grey and cream or whitish grey, may have imperfectly shed broad ribbons near the base of trunk.Pith oil glands present in or absent from branchlets"
"183","Eucalyptus erythrocorys","smooth, grey or grey-brown to cream or white, rarely developing a short stocking of loose thin brown box-bark on the lower trunk. "
"184","Eucalyptus erythronema","smooth throughout, dark satiny pink-brown to dark red, shedding in thin sheets to reveal powdery creamy-white."
"185","Eucalyptus eudesmioides","rough on the lower 2 m, grey to brown, fibrous, flaky, smooth above, white, sometimes cream to brown to green. "
"186","Eucalyptus eugenioides","rough to small branches, longitudinally fissured, stringy, grey to grey-brown."
"187","Eucalyptus ewartiana","minnirichi throughout, greyish over red-brown or green-brown, or, less commonly, partly rough, matted and fibrous on basal 1 m of largest trunks."
"188","Eucalyptus exilis","smooth throughout, whitish to pale grey over yellow to coppery, shedding in ribbons."
"189","Eucalyptus expressa","rough throughout extending to branches ca 5 cm diameter, stringy, brownish grey."
"190","Eucalyptus exserta","rough, usually to small branches, hard, fissured and fibrous, grey."
"191","Eucalyptus extensa","smooth, of \'oily\' appearance, dark grey to light brownish grey over yellowish green or bronze.Pith glands present in branchlets"
"192","Eucalyptus extrica","smooth throughout, grey to grey-brown, or with some persistent basal fibrous bark. "
"193","Eucalyptus falcata","smooth throughout, mottled silvery grey and pale pink-grey."
"194","Eucalyptus famelica","with thin grey rough and fibrous for up to 0.5 m of trunks of larger plants or smooth throughout, grey and pale pinkish brown."
"195","Eucalyptus fasciculosa","loose and rough near base but otherwise smooth, light grey to pinkish grey or creamy white."
"196","Eucalyptus fastigata","rough on trunk and larger branches, fibrous or stringy, often furrowed, grey or brown; smooth bark of branches white, cream, orange, grey or brown, with ribbons of decorticated bark conspicuous in the crown."
"197","Eucalyptus flindersii","usually smooth, pinkish grey over white, cream or grey, but sometimes partly rough and loose or box-like and grey. "
"198","Eucalyptus flocktoniae","usually smooth throughout, grey over white to salmon pink to coppery.Branchlets"
"199","Eucalyptus foecunda","rough over part or all of trunks, firmly held, thin and fibrous to loose and flaky, grey to blackish, smooth above pale grey and pale brown."
"200","Eucalyptus foliosa","wholly smooth, grey, grey-brown, rusty brown and greenish grey, ribbons sometimes present."
"201","Eucalyptus forrestiana","wholly smooth, grey over pale brown."
"202","Eucalyptus fraseri","rough for basal 1-3 m of trunk with friable surface but black and much hardened beneath, smooth above, grey to creamy white over orange shedding in long ribbons."
"203","Eucalyptus fraxinoides","rough on basal 4-5 m of trunk, compacted, grey, grey-brown or black; smooth bark white, cream or pale grey, with scribbles, occasionally with horizontal black scars, often ribbony, branchlets sometimes glaucous."
"204","Eucalyptus frenchiana","smooth throughout, grey over fawn to brown and salmon, shedding in long ribbons."
"205","Eucalyptus froggattii","rough and crumbly over most of trunk, box-type, blackish; smooth bark greenish grey, or green to brown, or yellow-grey, shedding in thin narrow ribbons."
"206","Eucalyptus fruticosa","rough over part or all of the stems sometimes extending to branches to ca 8 cm diameter, fibrous to flaky, grey-brown, smooth above pale tan and grey-brown, shedding in ribbons, but smaller mallees may be smooth-barked."
"207","Eucalyptus fulgens","rough usually to small branches, thick, fibrous, furrowed longitudinally, dark-grey; branches 8cm diameter sometimes smooth."
"208","Eucalyptus gamophylla","usually smooth throughout, white to grey to brown, sometimes cream to pink; occasionally with a short stocking of pale grey to yellowy brown rough flaky bark. "
"209","Eucalyptus gardneri","smooth throughout, shedding in short curly flakes, satiny grey over salmon-pink."
"210","Eucalyptus georgei","smooth throughout, pale grey and coppery-orange, shedding in long ribbons."
"211","Eucalyptus gillenii","smooth throughout, mottled grey, white, pinkish, and shades of brown. "
"212","Eucalyptus gillii","smooth throughout or with some rough, flaky or box-type grey or brown bark on lower 2 m of larger stems, the flakes shed imperfectly giving a curly appearance; smooth bark white, cream, pink or grey. Branchlets usually glaucous."
"213","Eucalyptus gittinsii","smooth, grey-brown over cream to creamy brown to yellow, sometimes with a short stocking of grey-brown ribbony rough bark. "
"214","Eucalyptus glaucescens","rough, fibrous, grey or grey-brown, on lower trunk of trees, shedding in ribbons above; smooth bark of upper trunks, and of mallees, white, orange, brown, green, grey, yellow or pink; horizontal black scars often present on trunk; branchlets usually glaucous."
"215","Eucalyptus glaucina","smooth, white and grey with patches of pink, orange or green; sometimes becoming granular or powdery with age."
"216","Eucalyptus globoidea","rough to small branches, stringy, furrowed down trunk, usually grey."
"217","Eucalyptus globulus","smooth apart from base which has persistent slabs, shedding in large strips and slabs; smooth bark white, cream, grey, pink, yellowish or pale creamy orange, often with ribbons of decorticated bark in the upper branches; branchlets occasionally glaucous."
"218","Eucalyptus glomericassis","smooth throughout, new bark pale pink to pale orange, maturing to white and then grey."
"219","Eucalyptus glomerosa","rough for basal 0.5-3 m of stems, matted and fibrous to thick, loose and flaky, yellow-brown weathering grey, smooth above coppery-orange to salmon pink."
"220","Eucalyptus gomphocephala","rough throughout, finely fibrous, flaky and grey, becoming tessellated on large, old stems."
"221","Eucalyptus gongylocarpa","usually smooth throughout, white to pale grey; sometimes with yellow-brown to red-brown flaky scaly rough bark. "
"222","Eucalyptus goniantha","b'grey to brown, smooth throughout."
"223","Eucalyptus goniocalyx","rough over all of trunk, sometimesextending to small branches, or the large branches smooth; rough bark fibrous or box-type, grey, grey-brown, smooth bark white, cream or grey. "
"224","Eucalyptus goniocarpa","smooth throughout, grey and pale tan to coppery."
"225","Eucalyptus gracilis","usually rough on lower stems (rarely smooth throughout), tessellated box-type, flaky or fibrous, grey or brown; smooth bark white, pink, brown or grey, sometimes powdery. "
"226","Eucalyptus grandis","rough, flaky, greyish on basal 1-4 m of trunk, smooth above, powdery, pale grey or white."
"227","Eucalyptus gregoriensis","smooth and powdery throughout, new bark pale pink, maturing to white. branchlets usually not glaucous, but occasionally glaucous."
"228","Eucalyptus gregsoniana","smooth, light grey to white with patches of yellow, pink or pale brown."
"229","Eucalyptus grisea","smooth throughout, becoming granular with age, predominantly grey to whitish to brown, mottled with cream, yellow or orange, shedding in patches."
"230","Eucalyptus grossa","rough over whole trunks or only on the base of smaller stems, fibrous, slightly fissured, grey to grey-brown."
"231","Eucalyptus guilfoylei","rough to small branches, fibrous, fissured, grey-brown."
"232","Eucalyptus gunnii","smooth throughout or with some imperfectly decorticated rough bark on basal 1 m of trunk; smooth bark mottled white, yellow, pink, brown, green or grey, branchlets often conspicuously glaucous."
"233","Eucalyptus gypsophila","rough for lower half of trunk, grey to brown, loose and flaky, smooth above light grey over pinkish grey to coppery cream."
"234","Eucalyptus haemastoma","smooth, white, grey, yellow or silvery grey, with prominent scribbles."
"235","Eucalyptus hallii","smooth, new bark pale orange to pale pink, maturing to white and grey, becoming granular with age,."
"236","Eucalyptus halophila","rough on base of or up to half of stems, pale grey, fibrous or shedding in thick strips, or smooth throughout, white and pale grey to greenish-grey. "
"237","Eucalyptus hebetifolia","rough with loose grey ribbons for about half of trunk, smooth above grey and greeny brown over yellow."
"238","Eucalyptus helidonica","rough over trunk and branches to 2-3 cm diameter then smooth, rough bark finely fibrous and prickly to touch, grey or grey-brown."
"239","Eucalyptus herbertiana","smooth and powdery throughout, new bark creamy-yellow, maturing to white. branchlets usually not glaucous, but occasionally slightly glaucous."
"240","Eucalyptus histophylla","smooth throughout but with conspicuous ribbons of shed bark, light grey, dark grey and pale pinkish brown."
"241","Eucalyptus horistes","rough over part or all of trunk, firmly fibrous at base then semi-persistent ribbons above, scruffy, grey-brown, or smooth throughout, grey-green, and grey-brown."
"242","Eucalyptus houseana","smooth throughout; newly exposed bark not powdery, pale pink to pale orange or buttery yellow, maturing to white or grey and powdery to touch."
"243","Eucalyptus howittiana","rough to branches ca 2 cm diameter, shortly fibrous and flaky box-type, often fissured, becoming tessellated on some older trunks, grey."
"244","Eucalyptus hypolaena","rough on the lower 2-3 m of trunk, dark grey to almost black, hard scaly-fibrous, flaky; smooth bark, white to grey to pale pink to pale orange; sometimes slightly powdery. "
"245","Eucalyptus hypostomatica","rough on trunk and larger branches, box-type, flaky, grey, branches 8 cm diameter usually smooth, grey."
"246","Eucalyptus ignorabilis","on trunk and branches rough, firm, fibrous, with interlocking fissures, spongy, grey or brown, smaller branches shedding in ribbons."
"247","Eucalyptus imitans","rough to 5 cm diameter branches, stringy, pale grey to grey-brown."
"248","Eucalyptus imlayensis","smooth throughout or with some thin persistent strips at the base of largest stems; smooth bark predominantly green, with orange, brown or grey patches, shedding in ribbons from the stems and branches."
"249","Eucalyptus impensa","smooth throughout, grey and brown to coppery."
"250","Eucalyptus incerata","smooth throughout, light grey-brown over orange."
"251","Eucalyptus incrassata","smooth throughout or with persistent rough grey to brown ribbons on base of stems, sometimes extending for 1-2 m; smooth bark salmon pink to grey-brown or pale grey, sometimes with a few ribbons on the upper branches."
"252","Eucalyptus indurata","rough on half to all of trunk, hard, compacted, furrowed shallowly (almost like ironbark), or rarely fibrous, blackish-grey to grey, smooth above whitish and grey. "
"253","Eucalyptus infera","smooth throughout, shiny, grey to coppery to olive-green."
"254","Eucalyptus insularis","smooth throughout on smaller plants, greenish grey to pale grey and pale bronze, some basal fibrous grey-brown bark on largest stems."
"255","Eucalyptus interstans","smooth, mottled grey, white, pink or orange."
"256","Eucalyptus intertexta","rough on lower trunk, rarely over whole trunk, thick, fibrous, often box-type, grey to red-brown; smooth above, predominantly white with grey or brown patches shedding in flakes; branchlets"
"257","Eucalyptus jacksonii","rough to small branches, stringy, thick, somewhat brittle, grey over red-brown. "
"258","Eucalyptus jensenii","rough, coarse, hard, black, furrowed, i.e. typical ironbark, extending to branches ca 3 cm diameter."
"259","Eucalyptus johnsoniana","rough, flaky to fibrous, grey-brown to yellow-brown, for up to 0.5 m of stems, or smooth throughout, greyish brown. "
"260","Eucalyptus johnstonii","smooth throughout or with some persistent, fibrous, grey bark on base of trunk; smooth bark yellow to orange-brown or greenish."
"261","Eucalyptus jucunda","smooth, grey or grey-brown to creamy-brown, occasionally with grey, crumbly, fibrous, flaky, ribbony bark persisting on the lower trunk. branchlets"
"262","Eucalyptus jutsonii","rough to branches ca 3 cm diameter, coarsely fissured and stringy-fibrous, grey. "
"263","Eucalyptus kabiana","normally smooth throughout, white to light grey to pink; sometimes with short stocking of grey fibrous rough bark on the larger plants."
"264","Eucalyptus kartzoffiana","rough on part or most of trunk, fibrous or box-type, grey or grey-brown; smooth bark white, cream, brown, grey or green, occasionally with with horizontal black scars, commonly with long ribbons of decorticated bark in the crown; branchlets often glaucous."
"265","Eucalyptus kenneallyi","smooth throughout, white to grey to brown or pink."
"266","Eucalyptus kessellii","rough, very hard and grey-brown to blackish over lower part of trunk, or smooth throughout on smaller mallees, smooth bark grey-brown and pale brown to pink-orange. "
"267","Eucalyptus kingsmillii","rough, grey and shaggy or flaky on part or all of trunk, sometimes smooth throughout with red-brown and whitish grey to grey-brown bark. "
"268","Eucalyptus kitsoniana","smooth throughout or with some persistent basal slabs of rough brown bark; smooth bark pale coppery to yellow-green or pink-brown or creamy white, at times with ribbons of decorticated bark in the upper branches."
"269","Eucalyptus kochii","usually rough over most of the stems and normally extending to the larger branches, flaky fibrous, sometimes fissured, usually firmly held, light grey, smooth bark above grey over red-brown."
"270","Eucalyptus kondininensis","rough, black or grey-black, coarsely flaky and fissured to hard and compact for about half of trunk, branches smooth, grey cream and orange."
"271","Eucalyptus kruseana","rough, thin, firmly held on base of trunks, fibrous, dark grey, smooth above bronze to coppery and dark grey, shedding in ribbons along the branches, rarely smooth throughout."
"272","Eucalyptus kybeanensis","smooth, white to cream, coppery, brown, green-grey or yellow-green, or pink-grey, often with scribbles, often with ribbons of decorticated bark in the upper branches."
"273","Eucalyptus lacrimans","smooth mainly white with patches of cream, grey or orange; branchlets glaucous."
"274","Eucalyptus laeliae","smooth white becoming yellow in spring, powdery."
"275","Eucalyptus laevis","rough over part or all of trunk, thin, shaggy and scaly or flat with shallow fissures, blackish and orange-brown, smooth above, grey to pale grey and orange to salmon-pink."
"276","Eucalyptus laevopinea","rough on trunk and larger limbs, stringy, thick, grey, or grey-brown; branches smooth, whitish-grey."
"277","Eucalyptus lanepoolei","smooth throughout but often appearing scaly with partly shed plates or flakes of red-brown bark over white to pinkish yellow or pale orange. "
"278","Eucalyptus langleyi","smooth throughout or with a few persistent strips at base of stems; smooth bark shedding in ribbons, grey, pinkish grey and yellow to brown."
"279","Eucalyptus lansdowneana","rough and grey, flaky or fibrous for up to 2 m of stems, or smooth throughout and coppery to grey or greenish grey or creamy brown, shedding in short strips."
"280","Eucalyptus largeana","rough on trunk and often larger branches, box-type often tessellated, grey; smooth bark white or grey."
"281","Eucalyptus largiflorens","rough to small branches, box-type often tessellated, dark grey. "
"282","Eucalyptus latens","smooth throughout, white to grey and coppery."
"283","Eucalyptus lateritica","usually rough over half of trunk, held in flattish strips or somewhat corky, grey-brown, while on smaller plants bark may be smooth, grey. "
"284","Eucalyptus latisinensis","rough to small branches, soft and finely fibrous to stringy, grey or grey-brown."
"285","Eucalyptus leprophloia","rough, fibrous, loose, grey-brown, for ca 1 m of trunks, becoming curly and flaky then smooth whitish grey to pale orange or pinkish grey."
"286","Eucalyptus leptophylla","smooth, grey, white, light pinkish grey or salmon, sometimes becoming granular with age, shedding in long strips. "
"287","Eucalyptus leptopoda","smooth throughout, mottled red-brown to salmon pink and white, sometimes powdery, rarely rough and flaky to fibrous, grey, on base of larger trunks. "
"288","Eucalyptus lesouefii","rough, black and crumbly to coarsely flaky on lower trunk, smooth above, coppery orange to creamy grey."
"289","Eucalyptus leucophloia","smooth and powdery throughout, new bark pale pink to pale orange, maturing to white and then weathering in patches to dark pink or grey. branchlets sometimes glaucous."
"290","Eucalyptus leucoxylon","smooth throughout, or with some incompletely shed rough, fibrous to flaky, grey to yellowish brown bark on lower stems; smooth bark yellowish with blue-grey and cream patches; horizontal bark scars sometimes present; branchlets not glaucous."
"291","Eucalyptus ligulata","smooth, pale whitish grey to greenish grey over pink-brown. branchlets "
"292","Eucalyptus ligustrina","rough to ca 2-3 cm branches, stringy, grey or grey-brown."
"293","Eucalyptus litoralis","rough but thin and more or less looseon part or all of trunk, fibrous, grey-brown; branches smooth pale grey to creamy."
"294","Eucalyptus litorea","rough, hard, grey, fissured, over most or all of trunks, smooth grey above."
"295","Eucalyptus livida","smooth throughout, pale grey, dark grey and orange."
"296","Eucalyptus lockyeri","usually rough to the base of the branches, sometimes rough only on the lower trunk, fibrous to flaky, dark grey. Smooth bark grey to pink-brown to orange-brown."
"297","Eucalyptus longicornis","usually rough over most of the stem, occasionally rough on the lower stem only, hard fibrous, fissured grey to grey-brown, larger branches usually smooth-barked, white to grey, rarely pink-grey to green-grey."
"298","Eucalyptus longifolia","rough, fibrous, thin, box-type, irregularly cracked to tessellated or flaky, grey, persisting to smaller branches or branches 8 cm diameter smooth."
"299","Eucalyptus longirostrata","smooth throughout, becoming granular with age and predominantly dull grey to grey-brown, shedding irregularly in strips to expose cream to pale orange to coppery new bark."
"300","Eucalyptus longissima","usually rough over most of the lower stem, hard, fibrous, flaky, grey to brown; occasionally completely smooth-barked, smooth bark grey over coppery-brown, rarely white and slightly powdery."
"301","Eucalyptus loxophleba","rough over most or all of trunk, tight, thin and fibrous or of thick loose flakes, grey to blackish or dark brown, branches smooth throughout, shiny, grey and olive green to brown, salmon or bronze."
"302","Eucalyptus lucasii","smooth throughout or rough only at base of trunk, flaky or ribbony and persistent, grey-brown, smooth bark dark to pale grey and pinkish brown to white. "
"303","Eucalyptus lucens","wholly smooth or with a very short basal stocking of pale grey box-type bark. Smooth bark pale grey-white fading to pale brown, shedding in short strips."
"304","Eucalyptus luculenta","smooth throughout, grey to white to pink. "
"305","Eucalyptus luehmanniana","smooth, shedding in strips, white to yellowish or brown, grey or olive."
"306","Eucalyptus macarthurii","rough, fissured longitudinally, fibrous, often hard, grey, continuing to smaller branches or the branches 8 cm diameter smooth, ribbons sometimes conspicuous in the crown."
"307","Eucalyptus mackintii","rough to small branches, stringy, grey to red-brown."
"308","Eucalyptus macrandra","usually smooth throughout, grey over grey-brown. pinkor salmon, rarely with a basal stocking of rough blackish bark."
"309","Eucalyptus macrocarpa","smooth throughout, shiny yellowish brown and grey-brown, shedding in short ribbons."
"310","Eucalyptus macrorhyncha","rough to small branches, stringy, often deeply furrowed, grey or grey-brown or red-brown."
"311","Eucalyptus magnificata","rough on trunk and larger branches, shortly fibrous or box-type, thin and flaky, grey and grey-brown smooth bark coppery, brown, grey-green, or grey. branchlets are rarely glaucous."
"312","Eucalyptus major","smooth, becoming granular with age, mottled grey, cream, pink, orange, shedding in strips."
"313","Eucalyptus malacoxylon","rough on trunk and branches to ca 5-8 cm diameter, tessellated or box-type, thick, grey."
"314","Eucalyptus mannensis","usually rough for up to 4 m of trunk, sometimes extending to ca 8 cm diameter branches, grey-brown, flaky and fibrous, smooth above, grey to white or pale orange. "
"315","Eucalyptus mannifera","smooth throughout or with some persistent rough, grey slabs at base of trunk; smooth bark usually powdery, white and grey; branchlets sometimes glaucous."
"316","Eucalyptus marginata","rough to 5-10 cm diameter branches, stringy in broad flat strips, grey to brown over rich red-brown."
"317","Eucalyptus mckieana","rough to small branches, stringy, deeply fissured, grey or grey-brown."
"318","Eucalyptus mcquoidii","smooth throughout, pale grey and whitish."
"319","Eucalyptus medialis","rough, loose, flaky, grey over yellowish on basal part of trunk, otherwise smooth, dark and light grey over pale orange to bronze."
"320","Eucalyptus mediocris","rough throughout, grey or grey-brown to yellowish grey or orange-brown-grey, fibrous, sometimes prickly to touch, held on trunk in flattish strips rather than like typical stringybark."
"321","Eucalyptus megacarpa","smooth, cream to cream-brown and bronze-grey. "
"322","Eucalyptus megacornuta","smooth throughout, mottled dark grey, light greeny grey and orange."
"323","Eucalyptus megasepala","rough to the small branches, grey over grey-brown, finely stringy or fibrous, sometimes quite hard, forming longitudinal furrows. "
"324","Eucalyptus melanophitra","rough, flaky and grey over all or part of trunk, smooth above grey to pale grey over salmon pink."
"325","Eucalyptus melliodora","fibrous or thin flakes held in variable amounts on trunk, sometime entire trunk rough, yellow-brown to yellow-grey; smooth bark pale grey to yellow; branchlets usually non-glaucous."
