"","eucalypts","bark"
"495","Eucalyptus spreta","smooth throughout, grey, orange-grey and whitish, shedding in long ribbons."
"496","Eucalyptus squamosa","rough throughout, tessellated, grey and red-brown."
"497","Eucalyptus staeri","rough over whole of trunk and branches to ca 4 cm diameter, fibrous, held in long flattened strips, grey-brown over reddish brown. "
"498","Eucalyptus stellulata","rough on lower trunk, compact and dark grey to black; smooth bark greenish, at times with ribbons of decorticated bark in the upper branches."
"499","Eucalyptus stenostoma","rough on lower trunk, compacted, shallowly fissured, grey; smooth bark yellow or creamy white; branchlets glaucous."
"500","Eucalyptus stoatei","wholly smooth grey over brown to cream, shedding in strips. "
"501","Eucalyptus stowardii","smooth throughout, grey over bronze to silvery pink."
"502","Eucalyptus striaticalyx","rough, thick, dark greyish and fibrous over part or all of trunk and sometimes extending to branches ca 5 cm diameter, smooth above creamy brown to pinkish."
"503","Eucalyptus stricklandii","rough for basal part of trunk, crumbly to flaky, grey-black and red-brown."
"504","Eucalyptus stricta","smooth, mottled pale grey, brown, white and pink, often with scribbles, at times with ribbons of decorticated bark in the upper branches."
"505","Eucalyptus strzeleckii","smooth throughout or with some slabs of fibrous grey to brown bark persistent at base of trunk; smooth bark mottled cream, yellow, pale brown, pinkish and green, often with ribbons of decorticated bark in the upper branches, branchlets non-glaucous."
"506","Eucalyptus sturgissiana","smooth, mottled light grey, grey-brown, pink and green, branchlets often glaucous."
"507","Eucalyptus subangusta","smooth throughout, pale and dark grey and grey brown to pinkish and coppery."
"508","Eucalyptus subcrenulata","smooth, pale grey or brown to yellow-green, horizontal black scars often present."
"509","Eucalyptus suggrandis","smooth throughout, pale shiny grey over grey-brown to brown."
"510","Eucalyptus surgens","rough over basal 0.5 m (or less) of trunks, greyish and fibrous, smooth pale grey to creamy brown above, shedding in strips."
"511","Eucalyptus sweedmaniana","smooth throughout, pale grey to silvery grey."
"512","Eucalyptus talyuberlup","smooth throughout, pale grey to pale pinkish, yellow-green or pale brown, shedding in ribbons."
"513","Eucalyptus tenella","rough to small branches, stringy, furrowed, grey to grey-brown."
"514","Eucalyptus tenera","smooth throughout, pale brown-grey, tan and satiny pale grey."
"515","Eucalyptus tenuipes","rough to small branches, fibrous, brown-grey, thick even on sapling growth, becoming fissured on larger stems."
"516","Eucalyptus tenuiramis","smooth throughout or with a few partly decorticated basal slabs of rough bark; smooth bark white to light grey or yellowish; branchlets glaucous."
"517","Eucalyptus tenuis","smooth throughout, rarely powdery, pale grey to whitish over orange to pale brown, shedding in long ribbons."
"518","Eucalyptus tephroclada","smooth throughout, rich coppery red and silvery brown to pale grey."
"519","Eucalyptus terebra","satiny or glossy, dark grey to orange, green-brown or yellowy green."
"520","Eucalyptus tereticornis","smooth throughout, mottled white, cream, yellow, pink and grey; sometimes with persistent dark grey flakes of rough bark on base of large trunks."
"521","Eucalyptus terrica","rough, thin, fibrous, grey over brown to orange, normally only on the trunk and larger branches, sometimes on the lower trunk only. Smooth bark on upper trunk or branches grey to brown to white over greenish-grey to yellowish-grey to yellowish-brown to orange-yellow."
"522","Eucalyptus tetraptera","smooth throughout, rarely with semi-persistent broad ribbons for ca 0.3 m of trunk, mottled dark and pale grey to silvery grey."
"523","Eucalyptus tetrodonta","rough to the small branches, grey over reddish brown, finely stringy or fibrous, forming longitudinal furrows. "
"524","Eucalyptus thamnoides","smooth throughout andpale grey over pink-copper and white, rarely partly rough with imperfectly shed basal ribbons of brown or grey bark."
"525","Eucalyptus thozetiana","smooth throughout or less commonly with a short stocking of tessellated blackish rough bark. Smooth bark pinkish to creamy white with greyish patches. Small curls or flakes of imperfectly shed bark may be present at times on the otherwise smooth stems."
"526","Eucalyptus tindaliae","rough on trunk and branches to about 6 cm diameter, stringy with shallow longitudinal fissures, grey and grey-brown."
"527","Eucalyptus tintinnans","smooth throughout, new bark pale orange to pale creamy-pink, maturing through brilliant salmon-pink to dull grey-white and weathering to grey just before decortication."
"528","Eucalyptus todtiana","rough, to smallest branches, fibrous, soft yellow-brown, prickly, or the lower trunk only rough and scaly with upper trunk and branches smooth grey to yellow and pinkish brown. "
"529","Eucalyptus torquata","rough, hard, dark grey to blackish, shortly fissured to almost tessellated, over most or all of trunk, branches smooth, various shades of dark grey to black."
"530","Eucalyptus transcontinentalis","smooth throughout, white to grey with pale pink or pale orange patches."
"531","Eucalyptus triflora","smooth throughout or, for the largest trees, with some compact, dark grey, rough bark at the base of the trunk; smooth bark white to cream or yellow-grey, with scribbles, the stems and crowns ribbony."
"532","Eucalyptus trivalva","partly or wholly rough on trunks with grey to reddish brown curly strips of partly decorticated bark (rarely smooth throughout); smooth bark pale grey to grey-brown, shiny pink-brown to greenish when newly exposed."
"533","Eucalyptus ultima","smooth over most of the stems or occasionally some stems with fibrous rough bark for basal part to 0.5 m. Smooth bark grey to pink-grey to white over cream to coppery."
"534","Eucalyptus umbra","rough to small branches, stringy or fibrous, grey or grey-brown."
"535","Eucalyptus umbrawarrensis","smooth and powdery throughout, new bark pale yellow to pale pink to pale orange, ageing to white."
"536","Eucalyptus urna","smooth throughout, grey to white to orange-brown or coppery, often highly glossy with a silvery appearance."
"537","Eucalyptus urnigera","smooth throughout or rarely with some rough strips retained at base of larger trunks; smooth bark mottled light grey, white, yellow, brown, pink and green; branchlets glaucous."
"538","Eucalyptus valens","smooth throughout, white or cream to pale grey and pinkish."
"539","Eucalyptus varia","smooth throughout, grey over greenish brown and pink to pale coppery."
"540","Eucalyptus vegrandis","smooth throughout, shedding in short ribbons, green-bronze to yellowish green over pinkish grey to brown."
"541","Eucalyptus vernicosa","smooth grey or grey-brown."
"542","Eucalyptus verrucata","smooth throughout or, on larger plants, rough, hard, fibrous, finely fissured and greyish brown on base of trunk; smooth bark bronze-brown to greyish white."
"543","Eucalyptus vesiculosa","smooth throughout, shiny, grey over rich red-brown."
"544","Eucalyptus vicina","usually smooth throughout, often powdery, mottled grey, brown, coppery, pink, orange and white."
"545","Eucalyptus victoriana","rough for only part of the trunk, rarely for most of the trunk, with the upper trunk and branches smooth. Rough bark long-fibrous and stringy where best developed lower on trunk, diminishing to fibrous/flaky then smooth pale grey and creamy white.."
"546","Eucalyptus viminalis","smooth over whole trunk or with a thick stocking of rough bark consistently to 2-6 m above base, fibrous, grey, brown or black; smooth bark often powdery, white to cream, yellow, light grey or pale brown, usually with conspicuous long ribbons of decorticated bark on upper trunk and in crown."
"547","Eucalyptus virginea","smooth throughout pale grey over powdery white to pinkish; sometimes with scribbles. "
"548","Eucalyptus viridis","rough, dark grey and box-type on lower stems, smooth above, grey-brown and coppery to bronze-grey and pink-grey, or smooth throughout. "
"549","Eucalyptus vittata","smooth throughout, grey and creamy whiteover yellow, tan or pale salmon, shedding in conspicuous long ribbons."
"550","Eucalyptus vokesensis","rough, fibrous, grey-brown, on lower trunks and large branches; smooth bark light grey or pale coppery brown or cream, often decorticating in ribbons or strips."
"551","Eucalyptus volcanica","on trunk partly rough to fully rough, often extending to larger branches, grey, box type; smooth bark grey to green, occasionally pink to brown."
"552","Eucalyptus wandoo","smooth throughout, often with scattered tardily deciduous flakes, white to mottled white and pale grey-brown over cream or pale yellow; bark of saplings fibrous on stems, becoming smooth as size increases. "
"553","Eucalyptus websteriana","minnirichi on trunk and branches, red to red-brown. "
"554","Eucalyptus wilcoxii","smooth throughout, pinkish brown to green, shedding in ribbons."
"555","Eucalyptus williamsiana","rough throughout, coarsely stringy, grey to grey-brown and deeply furrowed."
"556","Eucalyptus willisii","rough and extending often tosmallest branches, fibrous, peppermint-type, dark grey, or branches ca 5 cm diameter smooth, cream, pale grey or yellow-grey."
"557","Eucalyptus woodwardii","smooth, white over salmon to pink, shedding in long ribbons."
"558","Eucalyptus woollsiana","rough to 10-15 cm diameter branches, box-type or finely tessellated, grey or mottled grey and white; smooth bark pale grey to coppery."
"559","Eucalyptus wubinensis","smooth throughout, light grey to white-grey over tan or pinkish,and cream, shedding seasonally in long ribbons."
"560","Eucalyptus wyolensis","usually rough over most of the lower stem, sometimes extending to the larger branches, fibrous, light grey to brown; upper stem mostly smooth-barked, smooth bark grey to brown to cream."
"561","Eucalyptus xanthonema","smooth throughout, grey-brown and light grey over pinkish, grey ribbons may shed tardily at the base of stems."
"562","Eucalyptus yalatensis","rough, grey to grey-brown to white, box-type or flaky, on part or all of stems, often extending to branches ca 5 cm diameter; smooth above, pale grey to pink-salmon or pale brown."
"563","Eucalyptus yarraensis","rough over whole trunk and to 10 cm diameter branches, box-type, at times tessellated in part, grey; smooth bark of branches white to cream and green-brown."
"564","Eucalyptus yilgarnensis","rough over part or all of trunk, grey-brown to dark-grey, flaky, or smooth throughout and brown-grey to coppery, olive green or pinkish grey, branches smooth."
"565","Eucalyptus youmanii","rough to small branches, coarsely stringy and deeply, longitudinally furrowed, grey to grey-brown."
"566","Eucalyptus youngiana","rough over part or all of trunk, grey, fibrous or shedding imperfectly in broad strips, smooth above, or on smaller stems smooth throughout, whitish grey over yellowish or salmon pink. "
"567","Eucalyptus zopherophloia","rough over part or all of trunks, fibrous, firm, grey to grey-black, smooth grey over light creamy grey above."
