"","eucalypts","bark"
"1","Eucalyptus abdita","smooth throughout, grey."
"2","Eucalyptus absita","rough over part or all of trunks, box-type to fibrous, rarely smooth throughout, grey, yellow-grey and grey-brown, smooth above, grey over green-brown. "
"3","Eucalyptus acaciiformis","rough to small branches, stringy or fibrous, grey to grey-brown."
"4","Eucalyptus accedens","smooth throughout, powdery, white over pale orange to creamy pink."
"5","Eucalyptus acies","smooth, mottled shades of pale grey, pink-grey and brown-grey."
"6","Eucalyptus acmenoides","rough to small branches, fibrous, grey or grey-brown, held in flattish strips rather than typical stringybark."
"7","Eucalyptus acroleuca","rough on part or all of trunk, box-type or sometimes tessellated, grey or blackish, large branches and sometimes upper trunk smooth-barked, white to grey."
"8","Eucalyptus adesmophloia","partly rough with loose, papery or brittle ribbons of imperfectly shed pale grey-brown bark on at least base of or over most of trunk, smooth bark whitish to pink, pale orange or grey."
"9","Eucalyptus aequioperta","rough, dark grey, fairly firm and scaly or flaky to fibrous for about half of to all of trunk and large limbs to ca 15 cm diameter, becoming slightly tessellated on older trees, smooth above, dull pinkish grey to whitish."
"10","Eucalyptus agglomerata","rough to small branches, stringy or fibrous, dark grey or grey-brown."
"11","Eucalyptus alba","smooth, new bark pale orange to pale pink to pale yellow to creamy-white, maturing to white and weathering to grey or reddish brown just before decortication."
"12","Eucalyptus albens","rough on most or all of trunk and base of large branches, rarely extending to branches 8 cm diameter, box type, often becoming tessellated, pale grey or mottled grey and white patches, smooth bark of branches predominantly white, sometimes grey, or tinged orange, pink or salmon."
"13","Eucalyptus albopurpurea","rough on part or most of stems, fibrous to box-type, grey to grey-brown, or smooth throughout, grey to pink-grey or coppery brown, the crown sometimes ribbony."
"14","Eucalyptus alipes","smooth throughout, pale shiny grey over grey-brown to bronze."
"15","Eucalyptus alligatrix","rough to small branches or rarely the branches 8cm diameter smooth, rough bark thick, fibrous, coarsely furrowed down trunk, grey; branchlets rarely glaucous."
"16","Eucalyptus ammophila","rough, usually to the base of the branches, sometimes only on the lower trunk, fibrous, grey-brown. Upper trunk and branches with grey to grey-brown over orange to bronze smooth bark."
"17","Eucalyptus amplifolia","smooth throughout or with loose, greyish slabs persistent at base of trunk, smooth bark often becoming granular with age, white, grey, cream, brown or orange."
"18","Eucalyptus amygdalina","rough on part or all of trunk and to base of large branches, finely fibrous peppermint type, dark grey to grey-brown, smooth bark white to grey, or brownish, sometimes with ribbons of decorticated bark held in the upper branches."
"19","Eucalyptus andrewsii","rough throughout or only on trunk and large branches, finely fibrous (like peppermints), grey or grey-brown, smooth bark whitish."
"20","Eucalyptus angophoroides","rough on trunk and branches, shortly and closely fibrous, often tessellated, grey, or mottled with grey and white patches, horizontal black scars sometimes present on trunk."
"21","Eucalyptus angularis","rough for basal ca 1m of stem, grey, smooth above."
"22","Eucalyptus angulosa","smooth throughout with some grey, loose imperfectly decorticated strips of rough bark accumulating on lower stems; smooth bark pale grey, grey-brown, white or pinkish to coppery with ribbons of decorticated bark in the upper branches."
"23","Eucalyptus angustissima","smooth throughout, mottled pale grey, pale brown, orange and whitish, ribbons sometimes present."
"24","Eucalyptus annettae","rough hard and dark grey on lower ca 2 m of trunk,smooth greyover cream above that. Young reproductive trees may lack or have virtually no rough bark."
"25","Eucalyptus annulata","b usually smooth throughout, of 'oily' appearance, grey and red-brown to yellowish green."
"26","Eucalyptus annuliformis","smooth throughout, greyish. "
"27","Eucalyptus apiculata","smooth, cream, grey, brown or green."
"28","Eucalyptus apodophylla","smooth and very powdery throughout, new bark pale pink to pale yellow, maturing to white and sometimes weathering to grey just before decortication. branchlets very glaucous."
"29","Eucalyptus apothalassica","rough throughout, grey or grey-brown, fibrous, sometimes prickly to touch, held on trunk in flattish strips rather than typical stringybark."
"30","Eucalyptus approximans","smooth, grey, yellow, brown or greenish, occasionally with ribbons of decorticated bark in the upper branches."
"31","Eucalyptus arachnaea","rough, grey-black for up to 2-3 m of trunk, tightly fibrous and fissured to flaky, smooth above, grey and yellowish brown."
"32","Eucalyptus archeri","smooth, grey-green, grey, pinkish, white or brown, sometimes with horizontal black scars."
"33","Eucalyptus arenacea","rough to small branches in trees, stringy, grey or brown; in mallees shortly fibrous to flaky on stems with branches smooth."
"34","Eucalyptus arenicola","rough, extending to limbs to about 5 cm diameter, fibrous, peppermint-type, dark grey, smooth bark cream andpale grey."
"35","Eucalyptus argophloia","smooth throughout, sometimes with thin flakes or strips of decorticating bark persisting on the lower trunk. Smooth bark grey or reddish grey or brown over white to creamy-white to yellow."
"36","Eucalyptus argutifolia","smooth throughout, grey to pale coppery."
"37","Eucalyptus aridimontana","smooth throughout or rough for up tohalf the trunk, finely fibrous persistent box-type, grey-brown, smooth bark pale grey to brownish and bronze or orange-pink. "
"38","Eucalyptus armillata","smooth throughout, dark satiny pink-brown to pink-grey or dark red shedding in thin sheets to reveal powdery creamy white."
"39","Eucalyptus aromaphloia","rough to small branches or branches 8 cm diameter smooth; rough bark thick, furrowed longitudinally, dark grey to blackish, densely fibrous, sometimes with horizontal black scars, smooth branches salmon-coloured, sometimes with ribbons of decorticated bark in the upper branches."
"40","Eucalyptus aspersa","usually rough over most of the stems, flaky or fibrous, usually held in loose slabs, light grey to yellowish-brown, rarely almost smooth-barked."
"41","Eucalyptus aspratilis","rough for up to 2 m of trunks, loose, flaky to ribbony, grey to blackish brown, sometimes smooth throughout, silvery grey to pale brown-grey."
"42","Eucalyptus aurifodina","rough to small branches stringy, greyover red-brown."
"43","Eucalyptus badjensis","rough on lower trunk only, compacted, hard, blackish or grey, upper trunk and branches smooth grey, green, cream, brown or white, often with ribbons of decorticated bark in the upper branches."
"44","Eucalyptus baeuerlenii","smooth, pink, brown, grey, cream or green."
"45","Eucalyptus baileyana","rough on trunk and larger branches, stringy or fibrous, grey to reddish-brown."
"46","Eucalyptus baiophylla","rough flaky grey-black, red-grey or grey-brownbox-type on trunk often extending to branches 6 cm diameter, upper branchessmooth-barked and grey to pinkish-grey or orange. "
"47","Eucalyptus balladoniensis","rough, firm (compacted), fibrous to flaky on lower half of stems, dark grey, then shedding in short ribbons above to show smooth grey-brown to pink-brown and cream bark. "
"48","Eucalyptus bancroftii","smooth, sometimes becoming granular with age, mottled white, grey, orange, pink or brown."
"49","Eucalyptus banksii","rough on trunk and larger branches, fibrous or box-like, flaky, grey or grey-brown, smooth branches yellow."
"50","Eucalyptus barberi","smooth throughout or with loose, grey slabs of rough bark at base or trunks, smooth bark grey, white, cream, green, yellow or brown, often with ribbons of decorticated bark in the upper branches."
"51","Eucalyptus baudiniana","rough over part or all of trunk, fibrous to flaky, dark grey, then becoming smooth, grey-brown to brown."
"52","Eucalyptus baueriana","rough over trunk and branches, box-type, grey or mottled grey and white patches, branchlets occasionally glaucous. crown of mature tree often consisting of juvenile leaves."
"53","Eucalyptus baxteri","rough and stringy to small branches, grey to brown-grey."
"54","Eucalyptus beardiana","smooth throughout, pink and pink-grey (sometimes with thin curls of semi-persistent bark forming an attractive ring 5 cm high at the base of the trunk)."
"55","Eucalyptus behriana","on lower trunk rough, fibrous to box-type, dark brown to black, upper trunk and branches smooth, grey-brown to yellowish green or coppery, often with ribbons of decorticated bark on the branches. "
"56","Eucalyptus bensonii","rough on part or all of trunk and branches to 6 cm diameter, stringy, grey or brown, branches smooth above."
"57","Eucalyptus benthamii","smooth throughout or with partially adherent brownish rough bark at base of trunk, smooth bark bluish grey or white, branches ribbony."
"58","Eucalyptus bigalerita","smooth throughout, new bark pale orange to pale creamy-pink, maturing through brilliant salmon-pink to grey-white and weathering to grey just before decortication. Mature bark sometimes powdery."
"59","Eucalyptus blakelyi","smooth throughout or with some loose rough grey bark at base of trunk, smooth bark pale grey, cream and white with patches of yellow, pink, brown or orange."
"60","Eucalyptus blaxellii","smooth, grey over bronze, yellow-green or coppery, rarely with a very short stocking of brown fibrous rough bark."
"61","Eucalyptus blaxlandii","rough on trunk and branches 10cm diameter, stringy, dark brown to grey-brown, branches smooth-barked, whitish."
"62","Eucalyptus boliviana","rough throughout, stringy, grey to grey-brown. Branchlets slightly glaucous and strongly quadrangular, forming wings at each edge."
"63","Eucalyptus bosistoana","partly or wholly rough on trunk but sometimes almost smooth, branches always smooth; rough bark box-type, thin and flaky, mottled grey and white patches or grey-brown, smooth bark white, cream, yellow or grey, sometimes with with ribbons of decorticated bark in the upper branches."
"64","Eucalyptus botryoides","rough on trunk and larger limbs in thick, elongated, fibrous, grey or brown strips; smooth bark predominantly white, cream, or pale brown."
"65","Eucalyptus brachyandra","b'rough to small branches, fibrous to stringy, grey to brown or sometimes the larger branches smooth, grey to white."
"66","Eucalyptus brachycalyx","of trees fibrous and fissured yellow-brown to dark grey on part or all of trunk with branches smooth grey, brown, orange or pinkish to white. In mallees stems are smooth except for a short stocking of rough bark; the upper stems and branches may be ribbony."
"67","Eucalyptus brachyphylla","partly rough over trunk with imperfectly shed strips of greyish bark, smooth above, bronze and dark grey."
"68","Eucalyptus brandiana","smooth throughout,grey to silvery grey and salmon, shedding in irregularstrips."
"69","Eucalyptus brassiana","rough, usually only on the lower trunk for 2-4 m, sometimes rough to the small branches, often compacted and hard and fissured like that of an ironbark, dark grey to black. Smooth bark grey over white to creamy-yellow to orange."
"70","Eucalyptus brevifolia","smooth throughout, powdery white, weathering in patches to pink or grey."
"71","Eucalyptus brevipes","firm, fibrous to coarsely flaky, rough over part or all of trunk and often extending to ca 5 cm diameter branches, smooth above grey and bronze to salmon-pink. "
"72","Eucalyptus brevistylis","rough to ca 3 cm diameter branches, thick, long-fibred, fissured, tending to papery on the outside, grey-brown over red-brown."
"73","Eucalyptus bridgesiana","rough over whole trunk and larger branches, fibrous, usually tessellated and mottled grey and white."
"74","Eucalyptus brockwayi","smooth throughout, shiny, mottled light grey, salmon pink and creamy white."
"75","Eucalyptus brookeriana","rough, brown or grey, fibrous on lower 1-6 m of trunk, smooth above, white, cream, pinkish, orange, or olive-green to coppery, sometimes with horizontal black scars, often with ribbons of decorticated bark in the upper branches."
"76","Eucalyptus broviniensis","smooth, new bark pale orange, maturing to mottled grey, becoming granular with age,."
"77","Eucalyptus buprestium","smooth, greenish brown and cream, shedding in ribbons."
"78","Eucalyptus burgessiana","smooth throughout, white, pink, orange, pale brown or grey."
"79","Eucalyptus burracoppinensis","rough on basal part of trunk consisting of persistent thin strips of grey-brown bark, smooth above grey and coppery to pink. "
"80","Eucalyptus cadens","rough and compacted, dark grey, grey-brown or black, on 1-6 m of trunk, or with some loose basal slabs, smooth above, mostly green-grey often with a few ribbons of decorticated bark in the upper branches, branchlets sometimes glaucous."
"81","Eucalyptus caesia","minnirichi on trunk and branches, reddish-brown."
"82","Eucalyptus calcareana","smooth throughout, grey, cream, white and orange, shedding in ribbons."
"83","Eucalyptus calcicola","smooth, pale greenish grey, shedding in strips. "
"84","Eucalyptus caliginosa","rough to small branches, stringy, grey to grey-brown."
"85","Eucalyptus calycogona","rough over part of trunks, box-type to tessellated on older stems, grey-brown, smooth above, grey, grey-brown and yellow-cream, shedding in ribbons. "
"86","Eucalyptus calyerup","rough over the lower part of the trunk only, for up to 0.7 m, blackish grey, loose, fissured, fibrous, shedding in strips at its upper limit, smooth on upper trunk and branches, white to cream, pink and pale grey;sometimes smooth throughout."
"87","Eucalyptus camaldulensis","smooth throughout, often powdery, predominantly white, cream or grey but with patches of pink, red or brown. "
"88","Eucalyptus cambageana","rough for 2 to 3 m on the lower trunk, usually hard, tessellated or box-type, dark grey to black with abrupt change to smooth bark, which is normally white to grey, rarely creamy pink to yellow."
"89","Eucalyptus cameronii","rough and stringy to the small branches, grey or brown-grey."
"90","Eucalyptus camfieldii","rough, coarsely fissured and stringy to small branches, grey or grey-brown."
"91","Eucalyptus campaspe","smooth throughout, shiny, greenish grey to yellow-brown, red-brown or coppery."
"92","Eucalyptus camphora","smooth throughout or partly rough on lower trunk; rough bark either loose basal slabs, or compacted, dark brown, grey or blackish; smooth bark white-grey to grey-green, green or yellow-grey, sometimes slightly powdery."
"93","Eucalyptus canaliculata","smooth, becoming granular with age, predominantly grey or cream with brown, pink or orange patches."
"94","Eucalyptus canescens","rough, grey and flaky on stems and branches to ca 5 cm diameter, smooth above, light grey over brown."
"95","Eucalyptus canobolensis","smooth throughout or with some persistent rough, greyish bark at the base of trunk; smooth bark often powdery, white, cream, pale grey, yellow-orange or pink, sometimes horizontal black scars present, at times with ribbons of decorticated bark in the upper branches; branchlets glaucous."
"96","Eucalyptus capitellata","rough to small branches, stringy, grey or grey-brown."
"97","Eucalyptus carnabyi","smooth throughout, whitish grey to grey or mottled with brown. "
"98","Eucalyptus carnea","rough to small branches, stringy or fibrous, grey or grey-brown."
"99","Eucalyptus carnei","smooth throughout, grey over coppery, pinkish or cream, sometimes a short (ca 0.5 m) stocking of crumbly to flaky rough grey-black bark present."
"100","Eucalyptus celastroides","rough and flaky grey-brown for up to half of trunk then smooth, or smooth over whole stems, mottled whitish and pink-grey to salmon."
"101","Eucalyptus cephalocarpa","rough throughout, thick or the branches smooth; rough bark fibrous, longitudinally fissured, grey or grey-brown over red-brown, smooth bark pale brown to cream, branchlets often glaucous."
"102","Eucalyptus cerasiformis","pale grey and white mottled, sometimes powdery."
"103","Eucalyptus ceratocorys","rough for up to 3 m of the trunks of larger plants, with grey-brown shaggy, ribbony bark not shedding cleanly, smooth above, or on smaller plants smooth throughout, creamy grey to grey-brown."
"104","Eucalyptus cernua","smooth throughout, dark grey to black over greenish yellow, shedding in strips."
"105","Eucalyptus chapmaniana","on trunk partly or completely rough, fibrous and finely fissured longitudinally grey or brown-grey, branches smooth, light brown to creamy-white or pale grey, with long ribbons of decorticated bark in the branches, branchlets sometimes glaucous."
"106","Eucalyptus cinerea","rough to small branches, thick, fibrous, furrowed longitudinally, grey over red-brown."
"107","Eucalyptus cladocalyx","smooth, mottled white, yellow, pink, orange, brown, pale grey, dark grey or blue grey, sometimes slightly powdery."
"108","Eucalyptus clivicola","smooth throughout, dark and whitish grey over brownish, or mottled with imperfectly shed flakes of brown-grey rough bark."
"109","Eucalyptus cloeziana","rough, grey-brown to orange-brown to yellowish grey, over most of or whole trunk and sometimes extending to larger branches down to 20 cm diameter, smooth above. Rough bark thick,soft and flaky to fibrous becoming coarsely tessellated on older trunks; smooth bark white to grey-brown to orange."
"110","Eucalyptus cneorifolia","rough, narrowly fissured longitudinally, compacted, grey or brown-grey, upper stems and branches usually smooth, whitish to pale yellow-grey."
"111","Eucalyptus coccifera","smooth throughout or with a few loose basal grey slabs, smooth bark grey, cream, white, pinkish and fawn, occasionally with horizontal black scars, branchlets often glaucous."
"112","Eucalyptus comitae-vallis","rough, grey, shaggy to ribbony on part or all of trunks to 10 cm diameter branches, or on smaller mallees stems smooth throughout, pinkish grey to whitish and yellow-green."
"113","Eucalyptus communalis","smooth throughout, shedding in short ribbons, pale grey and pinkish grey over coppery to white."
"114","Eucalyptus concinna","rough grey-brown, thick to flaky or scaly for up to half of trunk, or sometimes entirely smooth, pale grey over coppery."
"115","Eucalyptus conferruminata","smooth throughout, greyor light grey, peeling to yellow cream, shedding in strips."
"116","Eucalyptus confluens","smooth throughout, powdery white over pale pink, weathering in patches to grey."
"117","Eucalyptus conglobata","smooth throughout, shedding in short strips, pale grey over creamy white."
"118","Eucalyptus conglomerata","grey-brown stringybark to small limbs, branchlets may be smooth."
"119","Eucalyptus conica","rough on trunk and branches to about 8 cm diameter, box-type, often tessellated or flaky, grey or grey-brown, smooth bark whitish."
"120","Eucalyptus consideniana","rough on most of trunk often extending to branches 8 cm diameter, finely fibrous, grey, grey-brown or greyish yellow, sometimes prickly, sometimes with horizontal black scars; smooth bark white or grey."
"121","Eucalyptus conspicua","rough to branches ca 3 cm diameter,loosely fibrous, longitudinally furrowed, grey over red-brown; branchlets glaucous."
"122","Eucalyptus conveniens","usually smooth, grey-brown over green, sometimes larger mallees with a short stocking of grey-brown ribbony rough bark. "
"123","Eucalyptus coolabah","rough on part or all of trunk, sometimes extending to the largest limbs, box-type or sometimes tessellated, grey, grey-brown or blackish, upper bark smooth, powdery, white, cream, pale grey or pink."
"124","Eucalyptus cooperiana","smooth throughout or with some persistent flaky-fibrous rough grey bark at the base of the stem, smooth bark powdery white over pale grey to pinkish grey."
"125","Eucalyptus cordata","smooth, mottled, greenish, white, brown, blue-greyand grey; on tallest trees there may be some basal slabs of rough grey-brown bark low on trunk; branchlets glaucous, squared in cross-section."
"126","Eucalyptus coronata","wholly smooth, pale grey and pale brown."
"127","Eucalyptus corrugata","usually rough dark grey to brown or yellow brown and scaly, flaky or thinly fibrous for up to 2 m of trunk, smooth above grey over salmon pink, sometimes prickly."
"128","Eucalyptus corticosa","rough on trunk, sometimes extending to small branches, fibrous, sometimes fissured and forming longitudinal slabs, sometimes tessellated in part, grey; smooth bark grey, grey-brown to pale orange."
"129","Eucalyptus cosmophylla","smooth throughout or with a few loose basal grey or brown rough slabs; smooth bark becoming granular with age, white to cream, grey, blue-grey or yellow."
"130","Eucalyptus crenulata","rough on trunk only or extending to 8 cm diameter branches in older trees, compacted, grey, brown or black; smooth bark grey, yellow or grey-brown, branchlets glaucous or non-glaucous."
"131","Eucalyptus creta","smooth throughout, shiny, grey over bronze to greenish brown."
"132","Eucalyptus cretata","rough, grey and coarsely flaky for lower part of stems, smooth above, pale grey to creamy yellow and pale brown; branchlets glaucous."
"133","Eucalyptus crispata","rough on lower trunk for up to 1 m, with imperfectly shed grey curls, smooth above, grey over pinkish."
"134","Eucalyptus croajingolensis","rough throughout or branches less than 8 cm diameter smooth; rough bark finely fibrous (peppermint-type), grey or grey-brown; smooth bark white or grey, often with scribbles, branchlets glaucous or non-glaucous."
"135","Eucalyptus crucis","thick, rough, densely and closely fibrous on most of trunk and larger branches, minnirichi only on smaller branches, green-fawn over rich red-brown."
"136","Eucalyptus cunninghamii","smooth, grey, often with scribbles."
"137","Eucalyptus cupularis","smooth and powdery throughout, new bark pale pink, maturing to white. Branchlets glaucous."
"138","Eucalyptus curtisii","smooth throughout, grey to silvery, shedding in short curly brown flakes."
"139","Eucalyptus cyanophylla","smooth or with a ragged stocking of partly shed grey or red-brown strips on lower stems; smooth bark pink to brown, or white to grey or orange-brown, often with ribbons of decorticated bark in the upper branches."
"140","Eucalyptus cyclostoma","smooth throughout, whitish grey to cream, brown and pinkish grey."
"141","Eucalyptus cylindriflora","smooth throughout, white to pale grey and yellowish grey."
"142","Eucalyptus cylindrocarpa","smooth throughout or sometimes with rough grey-brown loosely adherent thin flaky bark on base of stems, smooth bark pinkish grey to white, powdery at times."
"143","Eucalyptus cypellocarpa","smooth throughout, yellowish, pale grey, cream or grey-brown or orange-brown, or with some persistent slabs of rough bark or thin rough bark on lower trunk; often with horizontal bark scars on rough or smooth bark, ribbons of decorticated bark sometimes present."
"144","Eucalyptus dalrympleana","smooth throughout or with short stocking of persistent rough greyish bark; smooth bark yellow or white to cream with patches of grey, pink, brown and green, sometimes powdery, sometimes with horizontal black scars, often with ribbony crown."
"145","Eucalyptus dawsonii","smooth to small branches, or with a short stocking of persistent, flaky, grey or grey-brown rough bark; smooth bark often slightly powdery, mottled white, orange, brown, grey or yellow, branchlets glaucous."
"146","Eucalyptus dealbata","smooth throughout, or partly rough due to persistent slabs of grey bark on base of trunk; smooth bark white, grey, yellow, pink, brown, coppery or orange, branchlets glaucous."
"147","Eucalyptus deanei","smooth throughout, or sometimes with some persistent scaly grey or grey-brown bark at base of trunk; smooth bark white or cream, with patches of yellow, pink, grey or orange, sometimes powdery."
"148","Eucalyptus decurva","smooth throughout, pale whitish grey over salmon and yellow-green, surface may be powdery."
"149","Eucalyptus deflexa","smooth throughout, dark or pale grey to whitish."
"150","Eucalyptus delegatensis","rough on all or part of trunk, usually not furrowed, stringy or fibrous, grey to black, sometimes with horizontal black scars; smooth bark white, cream, yellow, grey or grey-green, often with scribbles, occasionally with ribbons of decorticated bark in the upper branches, branchlets glaucous or non-glaucous."
"151","Eucalyptus delicata","rough over most or on the lower portion of stem, dark grey to grey-brown, fibrous to scaly, smooth bark above white to pink-grey."
"152","Eucalyptus dendromorpha","usually rough on lower trunk, rough bark compacted, grey or brown; smooth bark white, cream, pink, green or grey, usually with scribbles, often ribbony. Young reproductively mature trees maylack any rough bark."
"153","Eucalyptus densa","smooth throughout, grey over pale coppery and brown."
"154","Eucalyptus denticulata","smooth except for some loose rough grey, black or brown bark at base of trunk; smooth bark white, cream, yellow, brown, green or grey, horizontal black scars usually present on trunk, often ribbons of decorticated bark hang in the upper branches."
"155","Eucalyptus depauperata","pale grey to grey and salmon-brown."
"156","Eucalyptus deuaensis","smooth, grey, brown, pink, white or yellow."
"157","Eucalyptus diminuta","smooth throughout, silvery white to greenish grey and coppery, or with a very short basal stocking of rough flaky grey-brown to blackish bark."
