"","eucalypts","bark"
"326","Eucalyptus merrickiae","rough and flaky, light grey-brown or grey-yellow, for part or all of trunks and base of larger branches, smooth above light grey."
"327","Eucalyptus michaeliana","smooth, mottled grey to blue-grey and white, cream, yellow, or pink."
"328","Eucalyptus micranthera","smooth throughout, shedding in ribbons, light grey to pinkish grey and yellow-grey. "
"329","Eucalyptus microcarpa","rough over whole trunk and to base of larger branches, box-type or tessellated, grey, grey- brown or mottled with grey and whitish patches; smooth bark usually white; pith of branchlets sometimes glandular."
"330","Eucalyptus microcorys","rough to small branches, softly stringy or fibrous, brown-grey to red-brown."
"331","Eucalyptus microneura","rough throughout, box-type, finely fissured, grey."
"332","Eucalyptus microschema","smooth throughout, dark and silvery grey over pink."
"333","Eucalyptus microtheca","rough, whitish grey to dark grey, box-type, often deeply fissured, coarsely flaky or becoming tessellated, the branches commonly rough-barked though this feature is variable."
"334","Eucalyptus mimica","smooth throughout, shiny pale grey-green over coppery brown."
"335","Eucalyptus misella","usually wholly smooth, grey, grey-brown, rusty brown and greenish grey, ribbons sometimes present, rarely with a persistent fibrous thin grey-brown basal stocking for ca 0.5 m of trunks on older plants."
"336","Eucalyptus mitchelliana","smooth white to yellow and creamy-grey; crown ribbony at times."
"337","Eucalyptus moderata","rough over most of the trunk, hard fibrous, sometimes extending to the larger branches, dark grey to black; smooth bark on upper trunk and larger branches, white to grey to creamy brown to pale pink. "
"338","Eucalyptus moluccana","rough on part or all of trunk, thin, box-type or tessellated, grey or mottled with grey and white patches; smooth bark white, cream or pale-grey, often shiny; pith of branchlets sometimes glandular."
"339","Eucalyptus mooreana","smooth and powdery throughout, new bark pale pink, maturing to white or grey. branchlets glaucous."
"340","Eucalyptus moorei","smooth, grey-brown to pale coppery with patches of orange and yellow."
"341","Eucalyptus morrisbyi","loose grey-black basal slabs for 1-2 m of trunk then smooth, pale grey, yellowish and pale coppery above; branchlets glaucous."
"342","Eucalyptus morrisii","of trees often rough to smaller branches, in mallees often only at base of stems; rough bark usually compacted, or fibrous or box-type, dark grey; smooth bark grey to green-grey, sometimes with a few ribbons in crown."
"343","Eucalyptus muelleriana","rough to small branches, stringy, grey-brown to grey-yellow."
"344","Eucalyptus multicaulis","smooth throughout or with 0.5 m of persistent rough bark at the base of stems; smooth bark grey or white; branchlets not glaucous."
"345","Eucalyptus myriadena","rough and coarsely flaky, grey-brown to grey-black usually for only about half of trunks then smooth above, bronze-grey and coppery."
"346","Eucalyptus nandewarica","smooth throughout or with persistent rough, fibrous bark on base of trunk for ca 1 m; smooth bark mottled white, grey, brown, cream or orange."
"347","Eucalyptus nebulosa","smooth, seasonally powdery, creamy white to yellowish and greeny bronze, shedding in short ribbons."
"348","Eucalyptus neglecta","rough, fibrous, fissured longitudinally and grey to brown on trunk of larger plants, otherwise smooth, grey-green to yellow-brown, crown at times ribbony; branchlets glaucous or non-glaucous; new growth tips quite glaucous."
"349","Eucalyptus neutra","smooth throughout, grey over cream to brown to salmon-pink to coppery (rarely yellow). "
"350","Eucalyptus newbeyi","smooth throughout, mottled yellow-brown and grey to creamy yellow, shedding in flakes."
"351","Eucalyptus nicholii","rough to small branches, thick, fibrous, grey or grey-brown, longitudinally furrowed."
"352","Eucalyptus nigrifunda","rough on base of trunk, rarely more, black and flaky, smooth above red-brown over grey to cream or orange."
"353","Eucalyptus nitens","smooth throughout or with a thin stocking of rough grey bark for basal 1 m of trunk; smooth bark predominantly pale grey to greenish-grey but with patches of white, cream or pale brown with horizontal black scars sometimes present; crown often ribbony."
"354","Eucalyptus nitida","rough on trunk and limbs of larger trees, and on base of stems in small trees and mallees, loosely woven peppermint-type, grey, trunks of small trees or mallees sometimes entirely smooth-barked; smooth bark cream to grey-green, yellow-grey or pink-brown, scribbles present; crowns often with long ribbons of bark incompletely shed from branches."
"355","Eucalyptus nobilis","smooth, shedding in long ribbons, white and pale grey; sometimes with persistent slabs of rough grey bark at base of trunk. "
"356","Eucalyptus normantonensis","rough and flaky, grey-brown, box-type, extending over part or all of stems, smooth above dark brown to grey-brown."
"357","Eucalyptus nortonii","rough to small branches, coarse and thick, fibrous or box-type, mottled grey and whitish or grey-brown; sometimes branches 8 cm diameter smooth; branchlets glaucous."
"358","Eucalyptus notabilis","rough to small branches, fibrous, brown-grey, fissured longitudinally forming broad flat strips."
"359","Eucalyptus notactites","smooth throughout, pale grey to grey-brown over pink-orange."
"360","Eucalyptus nova-anglica","rough throughout or branches 8 cm diameter smooth; rough bark thick, fibrous, longitudinally furrowed, grey and red-brown."
"361","Eucalyptus nudicaulis","smooth throughout, mottled grey to pinkish or silvery. "
"362","Eucalyptus nutans","smooth throughout, shiny, grey over pink-orange and coppery."
"363","Eucalyptus obconica","b'.rough to small branches, box-type or sometimes tessellated, light grey-brown to grey-white."
"364","Eucalyptus obesa","smooth throughout shedding in ribbons, grey over whitish to pale brown or pink."
"365","Eucalyptus obliqua","rough to small branches or sometimes branches 8 cm diameter smooth; rough bark stringy or fibrous, brown to grey-brown, longitudinally furrowed; smooth bark green or grey."
"366","Eucalyptus obtusiflora","rough, imperfectly shed grey to brown, ribbony for up to half of the stems thensmooth above, or smooth-barked throughout, grey over yellowish or salmon pink to creamy brown."
"367","Eucalyptus occidentalis","rough over part or all of trunk, sometimes extending to large limbs, black to dark grey, fibrous, fissured and often hard, shedding in broad scruffy strips at its upper limit, smooth above, white to pale grey or pale grey-brown, sometimes powdery."
"368","Eucalyptus ochrophloia","rough and tessellated, scaly, or box-type on lower trunk, dark grey to black with abrupt change to smooth bark, which is grey to coppery, pink, white, yellow or brown."
"369","Eucalyptus odontocarpa","usually smooth throughout, grey to brown to coppery, sometimes white to cream to pink, occasionally with a short stocking of pale grey to yellowy-brown rough flaky bark. Branchlets normally non-glaucous, rarely glaucous, with no oil glands in the pith."
"370","Eucalyptus odorata","rough on trunk and on branches to 5-10 cm diameter, tightly held box-type on larger stems, dark grey or grey-brown, smooth bark on branches grey, coppery or brown; branchlets with or without pith oil glands. "
"371","Eucalyptus oldfieldii","rough with semi-persistent broad grey-brown to black ribbons loosely sheathing part or all of trunk extending sometimes to limbs ca 5 cm diameter, or stems smooth throughout, grey and brown mottled. "
"372","Eucalyptus oleosa","usually rough on lower stems, flaky or fibrous, usually loose, grey to grey-brown, at times with short ribbons of decorticated bark in the upper branches; occasionally smooth barked to ground level, cream, grey-yellow, pink, brown or coppery."
"373","Eucalyptus olida","rough, thick, flaky and fibrous to branches 5-8 cm diameter, orange-brown or grey."
"374","Eucalyptus olivina","smooth throughout, grey to whitish over brown-grey, shedding in short strips."
"375","Eucalyptus olsenii","rough only on lower trunk, fibrous or flaky, grey or grey-brown; smooth bark white, cream or grey, often with ribbons of decorticated bark in the upper branches."
"376","Eucalyptus opimiflora","smooth throughout, creamy brown,grey and pale silver grey. "
"377","Eucalyptus optima","smooth throughout, white to grey to pale pink to pale orange to pale salmon."
"378","Eucalyptus oraria","rough only on lower trunk, flaky, grey, or smooth throughout grey-green over yellowish, shedding in strips."
"379","Eucalyptus orbifolia","of large stems sometimes rough, grey, thick and flaky at the base, otherwise minnirichi on trunk and branches, reddish brown. "
"380","Eucalyptus ordiana","smooth throughout, powdery white, weathering in patches to purple."
"381","Eucalyptus oreades","rough for up to 4 m at base of trunk, loose and grey; smooth bark powdery, cream, white, grey or yellow-brown, usually with ribbons of decorticated bark in the upper branches. Branchlets"
"382","Eucalyptus orgadophila","rough on the lower trunk, box-type, grey with abrupt change to smooth bark, which is normally white to grey, rarely creamy brown, sometimes shiny."
"383","Eucalyptus ornata","smooth throughout, mottled silvery grey and pale pink-grey. "
"384","Eucalyptus orthostemon","smooth throughout, shedding in short strips, coppery and grey-green to silvery grey."
"385","Eucalyptus ovata","smooth throughout or with loose, rough, grey to grey-brown bark to variable height on trunk; smooth bark white, cream, pale grey or pink-brown, occasionally powdery."
"386","Eucalyptus pachycalyx","smooth throughout, mottled white, cream, pale grey with newly exposed bark yellow to creamy pink to bright orange; often powdery."
"387","Eucalyptus pachyloma","smooth, grey to grey-brown and greenish."
"388","Eucalyptus pachyphylla","smooth pale brown, shedding in strips to reveal silvery to pale grey-white new bark."
"389","Eucalyptus paliformis","smooth throughout, grey to green or white with newly exposed bark yellow."
"390","Eucalyptus paludicola","smooth throughout or with some persistent, loose fibrous dark brown bark on lower stem; smooth bark pale brown, cream pink or grey, sometimes becoming granular with age."
"391","Eucalyptus pantoleuca","smooth and powdery throughout, new bark pale pink to pale orange, maturing to white. branchlets very glaucous and 4-angled."
"392","Eucalyptus parramattensis","smooth becoming granular with age, mottled grey, brown, yellow or pink."
"393","Eucalyptus parvula","smooth throughout or with some persistent rough, grey bark on lower trunk; smooth bark predominantly dark grey, at times with ribbons of decorticated bark in the upper branches."
"394","Eucalyptus patens","rough to small branches, stringy, crumbly, corky, fissured deeply longitudinally, grey-brown. "
"395","Eucalyptus pauciflora","smooth, predominantly white, cream and grey, with yellow patches, usually with scribbles; branchlets glaucous or non-glaucous."
"396","Eucalyptus pellita","rough throughout, fibrous, flaky grey or reddish-brown, sometimes tessellated or platy and held in long strips or slabs."
"397","Eucalyptus pendens","smooth, grey and pinkish. "
"398","Eucalyptus peninsularis","smooth throughout, grey or grey-brown over creamy-brown to pale coppery to pale orange, decorticating in ribbons which occasionally hang in the upper branches."
"399","Eucalyptus percostata","smooth, white, grey or coppery."
"400","Eucalyptus perriniana","smooth throughout, or rough only at base of trunks of largest individuals; smooth bark light coppery to greenish or white, shedding in ribbons; branchlets usually glaucous with leaf ring scars."
"401","Eucalyptus persistens","rough to small branches, box-type, grey. "
"402","Eucalyptus petiolaris","partly or wholly rough on trunk, sometimes extending to base of larger limbs, grey-brown to yellow-brown persistent flakes, smooth above pale grey, dark grey and yellowish cream. "
"403","Eucalyptus petraea","rough, thin, ribbony to flaky to fibrous and fissured over 1-2 m of trunk, bark on upper trunk and branches smooth, pink-grey, whitish grey and dark grey (rarely smooth bark throughout). "
"404","Eucalyptus petrensis","smooth throughout or on larger plants rough only at the base with some persistent ribbons, smooth bark pale grey and pale brown. "
"405","Eucalyptus phaenophylla","smooth throughout, grey to brown and orange-pink."
"406","Eucalyptus phenax","usually smooth, cream to grey and coppery, at times with ribbons of decorticated bark in the upper branches."
"407","Eucalyptus pilbarensis","smooth throughout, white and pale grey to pink or coppery."
"408","Eucalyptus pileata","wholly smooth, light grey to grey brown or greenish grey over orange to yellow; shedding in long ribbons conspicuous in springtime."
"409","Eucalyptus pilularis","rough on lower half of trunk, finely fibrous, grey or grey-brown; smooth bark not powdery or granular, smooth bark cream to white or grey, often with scribbles."
"410","Eucalyptus pimpiniana","smooth throughout, sometimes powdery, mottled salmon, pink, white, pale grey and brown."
"411","Eucalyptus piperita","rough on trunk and larger limbs, sometimes also on smaller branches, finely fibrous or peppermint-type, grey or grey-brown; branches usually smooth, white to cream or grey, often powdery."
"412","Eucalyptus planchoniana","rough to small branches or the branches 8 cm diameter smooth; rough bark stringy and shallowly fissured down trunk, usually red-brown, often prickly. "
"413","Eucalyptus platyphylla","smooth and sometimes powdery, new bark pale pink to creamy-white to greenish-white, maturing to white and weathering to grey or reddish brown just before decortication."
"414","Eucalyptus platypus","smooth throughout, grey-green over coppery brown."
"415","Eucalyptus pleurocarpa","smooth throughout, grey to grey-brown. "
"416","Eucalyptus polyanthemos","rough on trunk and branches, box-type, grey, brown-grey or mottled with grey and white patches; branchlets glaucous or non-glaucous."
"417","Eucalyptus polybractea","rough, box-type and pale grey to grey-brown on lower 1-2 m of stems; smooth light grey to dark grey, brown or pinkish, at times with ribbons of decorticated bark in the upper branches; smaller regenerating plants that are at flowering stage may be entirely smooth-barked; branchlets usually glaucous or rarelynon-glaucous."
"418","Eucalyptus populnea","rough to small branches, box-type or tessellated, grey to grey-brown."
"419","Eucalyptus porosa","rough on the short trunk and larger branches of trees, and on lower stems of mallees, box-type, dark grey to dark brown-grey or whitish grey; smooth bark whitish or grey; branchlets with or without oil glands in the pith. "
"420","Eucalyptus prava","smooth, becoming granular with age, mottled grey, orange, brown and pink; branchlets glaucous or non-glaucous."
"421","Eucalyptus preissiana","smooth, pale grey and brown. "
"422","Eucalyptus prominens","sometimes fibrous at the base to 0.5 m, more usuallywholly smooth and grey to pinkish-grey to greenish-brown. "
"423","Eucalyptus prominula","rough to small branches, stringy, greyand grey-brown."
"424","Eucalyptus propinqua","smooth, becoming granular with age, mottled grey, cream, pink, orange, coppery or yellow, shedding in strips."
"425","Eucalyptus protensa","smooth, of \'oily\' appearance, dark grey to light brownish grey over yellowish green or bronze.Pith glands present in branchlets"
"426","Eucalyptus provecta","rough, grey, box-type, extending to the small branches."
"427","Eucalyptus proxima","smooth throughout, grey over pale orange or coppery."
"428","Eucalyptus pruiniramis","rough for lower half of trunk, fibrous or persistent ribbons, dark grey to grey-brown or blackish, or completely smooth on smaller mallees."
"429","Eucalyptus pruinosa","rough, grey, box-type extending to the small branches, flaky or firm and fissured, sometimes with wavy pattern, sometimes becoming tessellated on older trunks."
"430","Eucalyptus psammitica","rough, stringy or fibrous, loose, prickly, not furrowed, grey or grey-brown."
"431","Eucalyptus pterocarpa","smooth throughout, pale and mid-grey to mottled brown and pinkish white, shedding in long ribbons."
"432","Eucalyptus pulchella","smooth throughout on smaller trees but on larger trees rough, fibrous, grey to grey-brown for ca 1-2 m of trunk; smooth bark white, cream, yellow, pink and grey, decorticating in ribbons."
"433","Eucalyptus pulverulenta","smooth throughout or with some short thin persistent ribbons at base of old trunks; smooth bark green to grey with brown, coppery or yellow patches; branchlets glaucous."
"434","Eucalyptus pumila","smooth, grey to pink, yellow-green, brown, cream or white, shedding from stems in ribbons."
"435","Eucalyptus punctata","smooth throughout, becoming granular with age, predominantly grey with pink, brown, cream, yellow and orange, shedding in patches."
"436","Eucalyptus purpurata","smooth throughout, mottled silvery grey to light grey over cream bark, shedding in strips."
"437","Eucalyptus pyriformis","smooth throughout or with a short stocking of persistent ribbony grey-brown bark, smooth bark grey-brown shedding to light brown or reddish grey. "
"438","Eucalyptus pyrocarpa","rough to larger limbs, fibrous, grey or brown; smooth bark grey to white, crown sometimes ribbony; branchlets glaucous and square in cross-section."
"439","Eucalyptus quadrangulata","rough to small branches, box-type, grey or whitish."
"440","Eucalyptus quadrans","of mallees smooth throughout, grey to pale grey over green-pink; trees have a stocking of scaly or flaky rough grey bark for up to 3 m of trunk. "
"441","Eucalyptus quaerenda","smooth throughout, mottled pale grey, pale brown, pinkish-grey and whitish, ribbons sometimes present on lower trunks. "
"442","Eucalyptus racemosa","smooth, rarely powdery, silvery white, cream, pale grey, orange-yellow, with scribbles."
"443","Eucalyptus radiata","rough on trunk and large limbs, smaller branches smooth; rough bark finely fibrous, peppermint-type, grey; smooth bark pale grey to grey-green."
"444","Eucalyptus raveretiana","rough on most or all of trunk and often on bases of large branches sometimes extending to branches 5 cm diameter, box-type, dark grey, thick, becoming fissured and tessellated. Smooth-barked above this, patchy pale grey to pink-grey to grey to green and creamy white shedding in long flakes."
"445","Eucalyptus ravida","smooth throughout, shiny, greyish green over coppery to red-brown."
"446","Eucalyptus recta","smooth throughout, mottled silvery grey and pale salmon-pink. "
"447","Eucalyptus recurva","smooth, grey, green, brown, white, cream and orange, at times with ribbons of decorticated bark in the branches."
"448","Eucalyptus redunca","smooth, grey and pale brown shedding in short ribbons."
"449","Eucalyptus regnans","rough for basalpart of trunk, fibrous or with crumbly surface, grey, brown or black, upper trunk smooth-barked; smooth bark cream, grey-green, pale grey, brown or yellow-white, seasonally with ribbons of decorticated bark in the upper branches."
"450","Eucalyptus relicta","rough to small branchlets, thick, deeply fissured, dark grey. "
"451","Eucalyptus remota","rough on whole trunk of trees or base of larger stems in mallees, fibrous, grey to grey-brown, sometimes smooth throughout; smooth bark yellow to grey."
"452","Eucalyptus resinifera","rough to small branches, stringy or fibrous, grey or grey-brown to red-brown, held in long, flat strips with shallow fissures in between."
"453","Eucalyptus retinens","rough on trunk and larger limbs, box-type, grey, smooth bark grey to green, pink or coppery."
"454","Eucalyptus rhomboidea","smooth throughout, grey to creamy-grey to orange-brown, shedding in strips and short ribbons. "
"455","Eucalyptus rigens","wholly smooth, grey over whitish grey to pinkish brown, shedding in strips."
"456","Eucalyptus rigidula","smooth throughout, white, pale grey and pale brown to salmon-brown, rarely powdery, or with persistent ribbony rough fibrous grey-brown bark on lower trunk."
"457","Eucalyptus risdonii","smooth throughout, mottled light grey, yellow, white or cream; branchlets glaucous; bark on small limbs show encircling scars left by fallen connate leaves."
"458","Eucalyptus robusta","rough to small branches, thick, fibrous, spongy, reddish-brown to grey-brown."
"459","Eucalyptus rodwayi","rough on trunk and larger branches, fibrous to box-type, the outer layer crumbly, inner layer hard, grey and grey-brown."
"460","Eucalyptus rosacea","smooth throughout, dark and light grey over pinkish grey or yellow-grey and white."
"461","Eucalyptus rowleyi","smooth throughoutwhitish, pale grey to pale orange and tan. "
"462","Eucalyptus roycei","rough on the lower trunk, grey to grey-brown, fibrous, flaky; smooth bark above grey to grey-green to creamy green to brownish cream. "
"463","Eucalyptus rubida","smooth throughout or with some patches of persistent rough, greyish bark at the base; smooth bark often powdery, white, cream, pale grey or pink, with horizontal black scars, usually with ribbons of decorticated bark in the upper branches; branchlets glaucous or non-glaucous."
"464","Eucalyptus rubiginosa","rough to 2 cm diameter branches, softly fibrous, thick, reddish-brown."
"465","Eucalyptus rudderi","rough to small branches, box-type, often tessellated, grey to pale grey."
"466","Eucalyptus rudis","rough, fibrous, grey over part or all of trunks, becoming tessellated on older trunks, extending sometimes to branches to ca 10 cm diameter, rarely trunks entirely smooth, greyish white and dark grey. "
"467","Eucalyptus rugosa","smooth throughout, cream to pale grey, pinkish grey or yellow-green, sometimes with ribbons of decorticated bark in the upper branches."
"468","Eucalyptus rugulata","smooth throughout, grey and silvery grey, shedding in strips."
"469","Eucalyptus rummeryi","rough to small branches, box-type, usually tessellated, grey to black."
"470","Eucalyptus rupestris","smooth throughout, satiny except where recently shed then powdery, new bark pale orange, ageing to white and weathering to grey in patches."
"471","Eucalyptus salicola","smooth throughout, powdery, white to pale grey over salmon pink."
"472","Eucalyptus saligna","rough and flaky, grey to grey-brown on basal 1-4 m of trunk, smooth above, bluish grey to cream, green, pink or brown."
"473","Eucalyptus salmonophloia","smooth throughout, pale grey over salmon-pink to cream, shedding in flakes."
"474","Eucalyptus salubris","smooth throughout, shiny, steely grey or olive green to tan, coppery or yellow."
"475","Eucalyptus sargentii","rough over part or all of trunk, grey to black and coarsely flaky and crumbly, rarely smooth throughout; smooth bark greenish-grey over pinky brown."
"476","Eucalyptus saxatilis","smooth, slightly powdery, pale grey to creamy white and pale coppery, pink or greenish, shedding in ribbons."
"477","Eucalyptus scias","rough throughout, fibrous, grey or brown, held in long strips or slabs with shallow furrows."
"478","Eucalyptus scoparia","smooth, powdery, white and grey, shedding in strips."
"479","Eucalyptus seeana","smooth, sometimes becoming granular with age, mottled grey, white, pink or orange."
"480","Eucalyptus selachiana","usually smooth, white to grey to grey-green to occasionally yellow, sometimes with a very short stocking of grey-brown tessellated, fibrous rough bark. "
"481","Eucalyptus semiglobosa","smooth throughout, pale grey to dark grey. "
"482","Eucalyptus semota","rough for part or whole trunk and extending to limbs ca 6-10 cm diameter, grey to black, box-type, flaking in short strips, grey to brown, pink or coppery."
"483","Eucalyptus sepulcralis","smooth, grey over pinkish grey."
"484","Eucalyptus serraensis","rough at least on trunk and often on limbs, firmly fibrous or quite hard, shallowly, longitudinally fissured, grey to grey-brown; smooth bark of branches brown or pale grey."
"485","Eucalyptus sheathiana","smooth throughout, white-grey over coppery, shedding in conspicuous long ribbons.Older branchlets"
"486","Eucalyptus sieberi","rough on trunk and base of large branches, at first thin, flaky and orange-brown, becoming compact, thick, longitudinally furrowed and dark grey to black as trees age; smooth bark sometimes powdery, white to cream or yellow; branchlets sometimes glaucous."
"487","Eucalyptus singularis","smooth throughout or with persistent rough grey to brown ribbons on base of trunk extending for ca 1 m; smooth bark grey-brown or pale grey, sometimes with a few ribbons on the upper branches."
"488","Eucalyptus smithii","of trees rough, compact and black on trunk, smooth above, sometimes powdery, white, cream, or green-brown, very ribbony; mallees usually smooth throughout."
"489","Eucalyptus socialis","usually persistent on lower trunks, grey to brown, loose flaky, shaggy, ribbony; smooth bark on upper trunks and branches grey over cream, rarely yellowy-green."
"490","Eucalyptus","rough to ca 5 cm diameter branches, hard and corky, not fibrous, forming multi-layered plates and strips, grey and brown. "
"491","Eucalyptus spathulata","smooth, satin-like throughout, silvery grey over coppery, pink and bronze."
"492","Eucalyptus sphaerocarpa","rough over trunk and branches, moderately long-fibrous and becoming somewhat compact and shallowly fissured, grey or grey-brown to yellow-brown."
"493","Eucalyptus splendens","rough to 4 cm diameter branches, firm to corky fibrous, hardly furrowed, grey or black."
"494","Eucalyptus sporadica","smooth throughout, silvery white to pinkish brown, grey-brown and pale coppery, shedding in ribbons."
